{
  "$schema": "https://json-schema.org/draft/2020-12/schema",
  "$id": "urn:deterministic-solutions:composes-semantic-authority:receipt:v1",
  "title": "Composes semantic authority receipt",
  "type": "object",
  "required": [
    "receiptType",
    "runId",
    "capabilityId",
    "authorityHash",
    "inputHash",
    "resultHash",
    "disposition",
    "findings"
  ],
  "properties": {
    "receiptType": {
      "const": "composes-semantic-authority-receipt.v1"
    },
    "runId": {
      "type": "string",
      "minLength": 1
    },
    "capabilityId": {
      "const": "composes-semantic-authority"
    },
    "authorityHash": {
      "type": "string",
      "pattern": "^sha256:[a-f0-9]{64}$"
    },
    "inputHash": {
      "type": "string",
      "pattern": "^sha256:[a-f0-9]{64}$"
    },
    "resultHash": {
      "type": "string",
      "pattern": "^sha256:[a-f0-9]{64}$"
    },
    "decisionId": {
      "type": "string",
      "minLength": 1
    },
    "resolvedRule": {
      "type": [
        "string",
        "null"
      ]
    },
    "disposition": {
      "enum": [
        "SEMANTIC_AUTHORITY_COMPOSED",
        "SEMANTIC_AUTHORITY_CONFLICT"
      ]
    },
    "findings": {
      "type": "array",
      "items": {
        "type": "object",
        "required": [
          "findingId"
        ],
        "properties": {
          "findingId": {
            "type": "string",
            "minLength": 1
          },
          "detail": {}
        },
        "additionalProperties": false
      }
    },
    "result": {}
  },
  "additionalProperties": false
}
